{
  "claim_level": "evidence_backed",
  "disallowed_claims": [
    "general_intelligence",
    "consciousness",
    "black_box_solved",
    "global_superiority",
    "generalized_cognition",
    "candidate_promotion",
    "endpoint_expansion",
    "reusable_lineage_pool_mutation"
  ],
  "inside_voice_adapter_status": "pond_backed",
  "lineage": {
    "contract_version": "inside_voice.mcp.consultation.v1",
    "derived_from": "inside_voice_consults/hard_gate_response.json",
    "mcp_endpoint": "http://127.0.0.1:8766",
    "request_hash": "fb38c47b67ff91b231cd5600632d7a88f8aa0bc718327f874e80646d2f599807",
    "response_hash": "8cd6afbc60152a3c4a148ab341d29bac642b471f83be9ee4071755311b09a267",
    "validates": "mcp_seasoning_ablation_control"
  },
  "proof_id": "019-mcp-seasoning-ablation-control",
  "public_private_boundary": "public_safe_task_artifacts_runtime_hashes_refs_scores_and_claim_boundaries_only",
  "required_artifacts": [
    "README.md",
    "blind_protocol.md",
    "task_selection_report.md",
    "ablation_design.md",
    "aggregate_results.json",
    "comparative_ablation_report.md",
    "runtime_visibility_report.md",
    "claim_register.json",
    "public_lineage_summary.md",
    "final_verdict.json",
    "proof_manifest.json",
    "runtime_visibility_report.json",
    "inside_voice_consults/hard_gate_request.json",
    "inside_voice_consults/hard_gate_response.json",
    "inside_voice_consults/task_001_seasoned_request.json",
    "inside_voice_consults/task_001_seasoned_response.json",
    "inside_voice_consults/task_001_ablated_request.json",
    "inside_voice_consults/task_001_ablated_response.json",
    "tasks/task_001/task_description.md",
    "tasks/task_001/baseline_solution.md",
    "tasks/task_001/seasoned_solution.md",
    "tasks/task_001/ablated_solution.md",
    "tasks/task_001/blind_scoring_results.json",
    "tasks/task_001/task_comparison.md",
    "tasks/task_001/task_verdict.json",
    "inside_voice_consults/task_002_seasoned_request.json",
    "inside_voice_consults/task_002_seasoned_response.json",
    "inside_voice_consults/task_002_ablated_request.json",
    "inside_voice_consults/task_002_ablated_response.json",
    "tasks/task_002/task_description.md",
    "tasks/task_002/baseline_solution.md",
    "tasks/task_002/seasoned_solution.md",
    "tasks/task_002/ablated_solution.md",
    "tasks/task_002/blind_scoring_results.json",
    "tasks/task_002/task_comparison.md",
    "tasks/task_002/task_verdict.json",
    "inside_voice_consults/task_003_seasoned_request.json",
    "inside_voice_consults/task_003_seasoned_response.json",
    "inside_voice_consults/task_003_ablated_request.json",
    "inside_voice_consults/task_003_ablated_response.json",
    "tasks/task_003/task_description.md",
    "tasks/task_003/baseline_solution.md",
    "tasks/task_003/seasoned_solution.md",
    "tasks/task_003/ablated_solution.md",
    "tasks/task_003/blind_scoring_results.json",
    "tasks/task_003/task_comparison.md",
    "tasks/task_003/task_verdict.json",
    "inside_voice_consults/task_004_seasoned_request.json",
    "inside_voice_consults/task_004_seasoned_response.json",
    "inside_voice_consults/task_004_ablated_request.json",
    "inside_voice_consults/task_004_ablated_response.json",
    "tasks/task_004/task_description.md",
    "tasks/task_004/baseline_solution.md",
    "tasks/task_004/seasoned_solution.md",
    "tasks/task_004/ablated_solution.md",
    "tasks/task_004/blind_scoring_results.json",
    "tasks/task_004/task_comparison.md",
    "tasks/task_004/task_verdict.json"
  ],
  "status": "complete",
  "targets": [
    "MCPSeasoningAblation",
    "BlindTransferControl",
    "RuntimeVisibilityAudit"
  ],
  "title": "MCP-Seasoning Ablation and Blind Transfer Control"
}
