{
  "claim_level": "evidence_backed",
  "disallowed_claims": [
    "LLM generated final answers",
    "general mathematical intelligence",
    "consciousness",
    "AGI",
    "hidden chain-of-thought",
    "unbounded natural-language math competence",
    "substrate learning beyond the toy deterministic curriculum"
  ],
  "inside_voice_adapter_status": "not_used_final_answers_generated_by_deterministic_cli",
  "lineage": {
    "contract_version": "math_pond.cli.v1",
    "derived_from": "curriculum/*.jsonl; tests/*.jsonl; pond_states/*/pond_state.json; python3 -m operational_cognition.cli.math_pond",
    "mcp_endpoint": "none:deterministic_cli_no_llm",
    "request_hash": "560fc54222da2be5070fc41cb9755f6ea696ad21e7284736c90bee1ff9434917",
    "response_hash": "85be5fe144b259f58d7df989d92b67da94269f8f68766e76ea2f705f3959d37d",
    "validates": "grade_ladder_math_seasoning_with_fail_closed_no_llm_cli_answers"
  },
  "proof_id": "028-developmental-learning-grade-ladder",
  "public_private_boundary": "All artifacts are public deterministic curriculum, tests, pond states, CLI outputs, metrics, and audits. No hidden chain-of-thought or private substrate data is exposed.",
  "required_artifacts": [
    "README.md",
    "proof_manifest.json",
    "curriculum/grade_1_lessons.jsonl",
    "curriculum/grade_2_lessons.jsonl",
    "seasoning/grade_1_ingest_report.json",
    "seasoning/grade_2_ingest_report.json",
    "tests/grade_1_test.jsonl",
    "tests/grade_2_test.jsonl",
    "tests/foundation_transfer_test.jsonl",
    "baseline/no_seasoning_results.json",
    "results/grade_1_results.json",
    "results/grade_2_results.json",
    "results/foundation_transfer_results.json",
    "results/no_llm_final_exam.json",
    "analysis/learning_progression_report.json",
    "analysis/motif_reuse_report.json",
    "analysis/fail_closed_report.json",
    "analysis/determinism_report.json",
    "analysis/hostile_learning_audit.json"
  ],
  "status": "complete",
  "targets": [
    "SubstrateLearning",
    "MotifReuse",
    "DeterministicNoLLMAnswering",
    "FailClosedMathPondCLI"
  ],
  "title": "Proof 028 - Developmental Learning Challenge 001 - Grade-Ladder Math Seasoning Test"
}
